Title,Authors,Abstract,Year,Department
"Deep Learning for Climate Prediction","Alice Smith;Bob Johnson;Carol Williams","This study develops convolutional neural networks and recurrent networks for predicting climate patterns and extreme weather events using attention mechanisms and transfer learning on historical climate data.",2024,Computer Science
"Ocean Acidification and Marine Ecosystems","Carol Williams;David Lee","We analyze the effects of carbon dioxide emissions on ocean pH levels and their impact on coral reefs and fish populations using machine learning for prediction.",2023,Environmental Science
"Renewable Energy Optimization with AI","Bob Johnson;Emma Davis;Frank Wilson","This paper presents novel algorithms for optimizing solar and wind energy systems using reinforcement learning and deep learning approaches for smart grid management.",2024,Engineering
"Healthcare Applications of Machine Learning","Alice Smith;Grace Chen","A comprehensive study on using neural networks and computer vision for automated disease diagnosis in medical imaging including CT scans and X-rays.",2023,Computer Science
"Sustainable Urban Development","David Lee;Emma Davis;Henry Martinez","This research examines the role of technology and data analytics in creating sustainable cities and communities with focus on transportation and resource optimization.",2024,Urban Planning
"Quantum Computing Fundamentals","Frank Wilson;Isabel Rodriguez","We provide an introduction to quantum error correction codes and their applications in near-term quantum computing devices for practical quantum algorithms.",2023,Physics
"Natural Language Processing for Social Good","Grace Chen;Jack Brown;Karen Lee","This work develops transformer-based language models for low-resource languages to support education and healthcare in developing regions.",2024,Computer Science
"Biodiversity Conservation Through Data Science","Henry Martinez;Isabel Rodriguez","Machine learning techniques are applied to analyze ecological data and predict species extinction risks to guide conservation efforts in protected areas.",2023,Environmental Science
"Industrial IoT and Edge Computing","Karen Lee;Liam Murphy","We propose efficient algorithms for real-time data processing on edge devices in industrial settings using lightweight neural networks and federated learning.",2024,Engineering
"Social Justice and Algorithmic Fairness","Jack Brown;Maria Garcia","This study examines bias in machine learning systems and proposes methods to ensure fairness and equity in AI applications used for criminal justice and hiring.",2023,Computer Science
